{"$id":"urn:cwr:hanna-public-result-v1:feedback-selection","$schema":"https://json-schema.org/draft/2020-12/schema","additionalProperties":false,"properties":{"format_version":{"const":1},"grok_selection":{"type":"object"},"kind":{"const":"hanna_r4_two_phase_grok_selection_feedback"},"producer":{"type":"object"},"source_artifact":{"type":"object"},"study_id":{"const":"hbq-human-alignment-optimizer-v4-balanced-dspy-heldout-exec-v1-public-result-v1"}},"required":["format_version","study_id","kind","producer","source_artifact","grok_selection"],"type":"object"}
