{"format_version":1,"grok_selection":{"baseline_candidate_id":"candidate-52d1be4bc34e0018","baseline_grok_mean_absolute_error":1.0694444444444444,"format_version":1,"grok_endpoints":[{"candidate_id":"candidate-0a0f419cd62b8742","endpoint":{"dimensions":{"Coherence":{"mean_absolute_error":2.375,"mean_coverage":1.0,"spearman":0.7745966692414834},"Complexity":{"mean_absolute_error":0.7916666666666667,"mean_coverage":1.0,"spearman":0.816496580927726},"Empathy":{"mean_absolute_error":0.25,"mean_coverage":1.0,"spearman":0.816496580927726},"Engagement":{"mean_absolute_error":1.4583333333333335,"mean_coverage":1.0,"spearman":0.7777777777777778},"Relevance":{"mean_absolute_error":0.9166666666666667,"mean_coverage":1.0,"spearman":0.7745966692414834},"Surprise":{"mean_absolute_error":0.29166666666666663,"mean_coverage":1.0,"spearman":0.5443310539518174}},"item_count":4,"macro_spearman":0.7507158886780023,"mean_absolute_error":1.0138888888888888,"mean_coverage":1.0,"prompt_group_count":4,"unit":"prompt_group_equal_weight"},"item_ids":["item-028fc3ac6963b50f","item-1568277c2dde9944","item-2ba42c130da729fa","item-d5fe1ae06099a06e"],"prompt_group_ids":["prompt-132112dd8eeb2d4d","prompt-3f844c5cdc6b51ae","prompt-6450c4baa52d6998","prompt-6a99e79cf010b289"]},{"candidate_id":"candidate-0ca942ad28cb4104","endpoint":{"dimensions":{"Coherence":{"mean_absolute_error":2.125,"mean_coverage":1.0,"spearman":0.31622776601683794},"Complexity":{"mean_absolute_error":0.7916666666666667,"mean_coverage":1.0,"spearman":0.816496580927726},"Empathy":{"mean_absolute_error":0.375,"mean_coverage":1.0,"spearman":0.816496580927726},"Engagement":{"mean_absolute_error":1.2083333333333335,"mean_coverage":1.0,"spearman":-0.5443310539518174},"Relevance":{"mean_absolute_error":0.5416666666666667,"mean_coverage":1.0,"spearman":0.9486832980505138},"Surprise":{"mean_absolute_error":0.20833333333333337,"mean_coverage":1.0,"spearman":0.3333333333333333}},"item_count":4,"macro_spearman":0.4478177508840533,"mean_absolute_error":0.875,"mean_coverage":1.0,"prompt_group_count":4,"unit":"prompt_group_equal_weight"},"item_ids":["item-028fc3ac6963b50f","item-1568277c2dde9944","item-2ba42c130da729fa","item-d5fe1ae06099a06e"],"prompt_group_ids":["prompt-132112dd8eeb2d4d","prompt-3f844c5cdc6b51ae","prompt-6450c4baa52d6998","prompt-6a99e79cf010b289"]},{"candidate_id":"candidate-16be7c0d16650192","endpoint":{"dimensions":{"Coherence":{"mean_absolute_error":2.375,"mean_coverage":1.0,"spearman":0.7745966692414834},"Complexity":{"mean_absolute_error":0.9166666666666667,"mean_coverage":1.0,"spearman":null},"Empathy":{"mean_absolute_error":0.625,"mean_coverage":1.0,"spearman":0.8333333333333334},"Engagement":{"mean_absolute_error":1.2083333333333335,"mean_coverage":1.0,"spearman":0.05555555555555555},"Relevance":{"mean_absolute_error":1.0416666666666667,"mean_coverage":1.0,"spearman":0.7745966692414834},"Surprise":{"mean_absolute_error":0.33333333333333337,"mean_coverage":1.0,"spearman":0.3333333333333333}},"item_count":4,"macro_spearman":null,"mean_absolute_error":1.0833333333333333,"mean_coverage":1.0,"prompt_group_count":4,"unit":"prompt_group_equal_weight"},"item_ids":["item-028fc3ac6963b50f","item-1568277c2dde9944","item-2ba42c130da729fa","item-d5fe1ae06099a06e"],"prompt_group_ids":["prompt-132112dd8eeb2d4d","prompt-3f844c5cdc6b51ae","prompt-6450c4baa52d6998","prompt-6a99e79cf010b289"]},{"candidate_id":"candidate-331f9d912c6231c3","endpoint":{"dimensions":{"Coherence":{"mean_absolute_error":2.0,"mean_coverage":1.0,"spearman":0.4472135954999579},"Complexity":{"mean_absolute_error":0.9166666666666667,"mean_coverage":1.0,"spearman":null},"Empathy":{"mean_absolute_error":0.75,"mean_coverage":1.0,"spearman":0.5443310539518174},"Engagement":{"mean_absolute_error":1.125,"mean_coverage":1.0,"spearman":0.21081851067789195},"Relevance":{"mean_absolute_error":0.6666666666666667,"mean_coverage":1.0,"spearman":0.8944271909999159},"Surprise":{"mean_absolute_error":0.3750000000000001,"mean_coverage":1.0,"spearman":-0.3333333333333333}},"item_count":4,"macro_spearman":null,"mean_absolute_error":0.9722222222222223,"mean_coverage":1.0,"prompt_group_count":4,"unit":"prompt_group_equal_weight"},"item_ids":["item-028fc3ac6963b50f","item-1568277c2dde9944","item-2ba42c130da729fa","item-d5fe1ae06099a06e"],"prompt_group_ids":["prompt-132112dd8eeb2d4d","prompt-3f844c5cdc6b51ae","prompt-6450c4baa52d6998","prompt-6a99e79cf010b289"]},{"candidate_id":"candidate-35edf4e68944e533","endpoint":{"dimensions":{"Coherence":{"mean_absolute_error":2.25,"mean_coverage":1.0,"spearman":0.7745966692414834},"Complexity":{"mean_absolute_error":1.9166666666666667,"mean_coverage":1.0,"spearman":null},"Empathy":{"mean_absolute_error":0.5,"mean_coverage":1.0,"spearman":null},"Engagement":{"mean_absolute_error":1.3333333333333335,"mean_coverage":1.0,"spearman":0.9428090415820635},"Relevance":{"mean_absolute_error":0.9166666666666667,"mean_coverage":1.0,"spearman":0.9486832980505138},"Surprise":{"mean_absolute_error":0.5000000000000001,"mean_coverage":1.0,"spearman":-0.3333333333333333}},"item_count":4,"macro_spearman":null,"mean_absolute_error":1.2361111111111112,"mean_coverage":1.0,"prompt_group_count":4,"unit":"prompt_group_equal_weight"},"item_ids":["item-028fc3ac6963b50f","item-1568277c2dde9944","item-2ba42c130da729fa","item-d5fe1ae06099a06e"],"prompt_group_ids":["prompt-132112dd8eeb2d4d","prompt-3f844c5cdc6b51ae","prompt-6450c4baa52d6998","prompt-6a99e79cf010b289"]},{"candidate_id":"candidate-491bd83568aa1d87","endpoint":{"dimensions":{"Coherence":{"mean_absolute_error":2.25,"mean_coverage":1.0,"spearman":0.7745966692414834},"Complexity":{"mean_absolute_error":0.9166666666666667,"mean_coverage":1.0,"spearman":null},"Empathy":{"mean_absolute_error":1.0,"mean_coverage":1.0,"spearman":0.9428090415820635},"Engagement":{"mean_absolute_error":1.3333333333333335,"mean_coverage":1.0,"spearman":0.9428090415820635},"Relevance":{"mean_absolute_error":1.4166666666666667,"mean_coverage":1.0,"spearman":0.7745966692414834},"Surprise":{"mean_absolute_error":0.2500000000000001,"mean_coverage":1.0,"spearman":null}},"item_count":4,"macro_spearman":null,"mean_absolute_error":1.1944444444444444,"mean_coverage":1.0,"prompt_group_count":4,"unit":"prompt_group_equal_weight"},"item_ids":["item-028fc3ac6963b50f","item-1568277c2dde9944","item-2ba42c130da729fa","item-d5fe1ae06099a06e"],"prompt_group_ids":["prompt-132112dd8eeb2d4d","prompt-3f844c5cdc6b51ae","prompt-6450c4baa52d6998","prompt-6a99e79cf010b289"]},{"candidate_id":"candidate-52d1be4bc34e0018","endpoint":{"dimensions":{"Coherence":{"mean_absolute_error":2.25,"mean_coverage":1.0,"spearman":0.7745966692414834},"Complexity":{"mean_absolute_error":1.1666666666666667,"mean_coverage":1.0,"spearman":-0.2721655269759087},"Empathy":{"mean_absolute_error":0.75,"mean_coverage":1.0,"spearman":0.5443310539518174},"Engagement":{"mean_absolute_error":1.3333333333333335,"mean_coverage":1.0,"spearman":0.9428090415820635},"Relevance":{"mean_absolute_error":0.6666666666666667,"mean_coverage":1.0,"spearman":0.8944271909999159},"Surprise":{"mean_absolute_error":0.2500000000000001,"mean_coverage":1.0,"spearman":null}},"item_count":4,"macro_spearman":null,"mean_absolute_error":1.0694444444444444,"mean_coverage":1.0,"prompt_group_count":4,"unit":"prompt_group_equal_weight"},"item_ids":["item-028fc3ac6963b50f","item-1568277c2dde9944","item-2ba42c130da729fa","item-d5fe1ae06099a06e"],"prompt_group_ids":["prompt-132112dd8eeb2d4d","prompt-3f844c5cdc6b51ae","prompt-6450c4baa52d6998","prompt-6a99e79cf010b289"]},{"candidate_id":"candidate-83f13172e6bb7d62","endpoint":{"dimensions":{"Coherence":{"mean_absolute_error":2.0,"mean_coverage":1.0,"spearman":0.4472135954999579},"Complexity":{"mean_absolute_error":0.875,"mean_coverage":1.0,"spearman":-0.05555555555555555},"Empathy":{"mean_absolute_error":0.375,"mean_coverage":1.0,"spearman":0.816496580927726},"Engagement":{"mean_absolute_error":1.3333333333333335,"mean_coverage":1.0,"spearman":0.9428090415820635},"Relevance":{"mean_absolute_error":0.6666666666666667,"mean_coverage":1.0,"spearman":0.8944271909999159},"Surprise":{"mean_absolute_error":0.5416666666666666,"mean_coverage":1.0,"spearman":-0.5443310539518174}},"item_count":4,"macro_spearman":0.4168432999170484,"mean_absolute_error":0.9652777777777778,"mean_coverage":1.0,"prompt_group_count":4,"unit":"prompt_group_equal_weight"},"item_ids":["item-028fc3ac6963b50f","item-1568277c2dde9944","item-2ba42c130da729fa","item-d5fe1ae06099a06e"],"prompt_group_ids":["prompt-132112dd8eeb2d4d","prompt-3f844c5cdc6b51ae","prompt-6450c4baa52d6998","prompt-6a99e79cf010b289"]},{"candidate_id":"candidate-c4dbe6d5ab48a98c","endpoint":{"dimensions":{"Coherence":{"mean_absolute_error":2.5,"mean_coverage":1.0,"spearman":null},"Complexity":{"mean_absolute_error":0.9166666666666667,"mean_coverage":1.0,"spearman":null},"Empathy":{"mean_absolute_error":0.75,"mean_coverage":1.0,"spearman":-0.2721655269759087},"Engagement":{"mean_absolute_error":1.5833333333333335,"mean_coverage":1.0,"spearman":0.2721655269759087},"Relevance":{"mean_absolute_error":1.1666666666666667,"mean_coverage":1.0,"spearman":0.9486832980505138},"Surprise":{"mean_absolute_error":0.2500000000000001,"mean_coverage":1.0,"spearman":null}},"item_count":4,"macro_spearman":null,"mean_absolute_error":1.1944444444444444,"mean_coverage":1.0,"prompt_group_count":4,"unit":"prompt_group_equal_weight"},"item_ids":["item-028fc3ac6963b50f","item-1568277c2dde9944","item-2ba42c130da729fa","item-d5fe1ae06099a06e"],"prompt_group_ids":["prompt-132112dd8eeb2d4d","prompt-3f844c5cdc6b51ae","prompt-6450c4baa52d6998","prompt-6a99e79cf010b289"]},{"candidate_id":"candidate-e7b450fb94085024","endpoint":{"dimensions":{"Coherence":{"mean_absolute_error":2.25,"mean_coverage":1.0,"spearman":0.7745966692414834},"Complexity":{"mean_absolute_error":1.1666666666666667,"mean_coverage":1.0,"spearman":0.5443310539518174},"Empathy":{"mean_absolute_error":0.75,"mean_coverage":1.0,"spearman":0.5443310539518174},"E